,cafe,review,친절해요,커피가 맛있어요,인테리어가 멋져요,디저트가 맛있어요,매장이 청결해요,음료가 맛있어요,대화하기 좋아요,사진이 잘 나와요,뷰가 좋아요,가성비가 좋아요,집중하기 좋아요
1,더숲 초소책방,사장님이 정말 친절하세요 감동 수준 바람이 심하게 날리는 편입니다 파라솔이 무너지는 경우가 종종있는 것 같으니 주의하세요 빵 기대 별로 안했는데 너무 맛있어서 당황했구요 풍경 그동안 서울에서 뷰 제일 좋은 카페라고 생각한 곳은 따로있었는데 여기로 제 맘속의 순위가 바뀌어야할 것 같네요,1,0,0,1,0,0,0,0,1,0,0
2,더숲 초소책방,예전 초소를 멋지게 바꾸어 카페를 만든 곳이예요 워낙 유명한 곳이라 평일에도 차들과 사람이 넘쳐나는 곳입니다 저는 토요일 아침 오픈 시간에 왔는데도 벌써 주차된 차들이 대 있었어요 커피는 진한 맛으로 빵과 함께 먹어야 더 맛이 좋은 것 같아요,0,1,0,1,0,0,0,0,1,0,0
3,더숲 초소책방,방송을 타서 그런지 정말 사람이 많았아요 왠만하면 오후 늦게 가시길 추천 빵 맛집입니다 뷰도 나름 괜찮고 선선하니 좋은데 사람이 많아 다음엔 늦게 가야겠어요,0,0,0,1,0,0,0,0,0,0,0
4,더숲 초소책방,뷰가 좋아 조용히 오전중으로 책 읽고 오려다가 사람이 너무 많아 구석진 바위에 앉아 땀 식히고 갑니다 배고파서 허겁지겁 빵 맛있게 먹었어요,0,0,0,1,0,0,0,0,1,0,0
5,더숲 초소책방,집 근처라서 자주 가는 곳 이긴한데 갈때마다 이쁘네요 주말엔 사람도 많고 북적이긴한데 아이들이랑 같이 처음 갔는데 좋아하더라고요 저흰 걸어갔지만 주차문제 때문에 좀 그렇긴한데 집 근처에 있어서 좋긴하네요 뷰맛집 뷰이쁨 걷기좋음 인왕산초소카페,0,0,0,0,0,0,0,0,1,0,0
6,더숲 초소책방,뷰맛집 방송 타고 사람이 더 많아져서 아쉽지만 날씨 좋을 시기에 와보고 싶어서 이른 시간에 방문 주말이고 손님 많을때 왠 바 자회 인가 해서 주차장 공간이 없어지는 바람에 인근에 불법 주차 차량이 너무 많아 좀 불쾌했습니다,0,0,0,0,0,0,0,0,1,0,0
7,더숲 초소책방,인왕산 숲길이나 자락길 산책하면서 꼭 가보세요 서울뷰 이렇게 예쁘게 잘 보이는 곳이 있나싶어요 주차자리는 좁으니까 대중교통 이 용해서 걸어가시는거 추천합니다 의외로 멀지 않고 갈만해요,0,0,0,0,0,0,0,0,1,0,0
8,더숲 초소책방,평일 아침 낮에 가면 사람이 적어서 뷰 즐기기 좋아요 빵 가격대가 높은 편이지만 맛있어요,0,0,0,1,0,0,0,0,1,0,0
9,에디션덴마크쇼룸,북유럽에서 유명한 커피컬렉티브 커피를 맛볼수 있다는 기대감에 설레이며 방문해서 일단 라떼 한잔 그리고 설명만으로 이미 넉다운된 초코타르트 우와 진짜 너무너무 맛있어서 거의 기절했어요 차근차근 종류별로 다 마셔보구 맛봐야겠어요,0,1,0,1,0,0,0,0,0,0,0
10,에디션덴마크쇼룸,너무 애정하는 꿀과 티를 수입하는 아름다운 곳,0,0,0,0,0,1,0,0,0,0,0
11,에디션덴마크쇼룸,화이트템플 그린자스민트 향 너무좋아요 선물하기도 좋고 내가 즐기기에도 좋아요,0,0,0,0,0,1,0,0,0,0,0
12,에디션덴마크쇼룸,제가 마셔본 티중에 젤로 맛있었어요 깨끗하고 달콤하며 향긋한 맛 직원분께서 추천해주신티가 너무 좋아 티까지 구매하게 되었답니다 친절한 직원분,1,0,0,0,0,1,0,0,0,0,0
13,에디션덴마크쇼룸,추천 받아서 방문해봤습니다 티랑 크래커랑 너무 맛있어요,0,0,0,1,0,1,0,0,0,0,0
14,에디션덴마크쇼룸,공간도 크고 넓고 친절하시고 좋아요 커피랑 디저트도 맛있어요,1,1,1,1,0,0,0,0,0,0,0
15,에디션덴마크쇼룸,맛있는 차와 커피 소박한 매장이지만 조용하고 선곡이 너무 좋아요 오픈형 천장 덕분에 시간따라 다른 분위기를 즐길 수 있었어요,0,1,1,0,0,1,0,0,0,0,0
16,에디션덴마크쇼룸,직원분들 다 친절하시고 커피도 맛있고 좋았어요,1,1,0,0,0,0,0,0,0,0,0
17,아키비스트,드디어 와본 아키비스트 대표 색상이 그린그륀 요즘 계절에 딱이네요 사람들 엄 청 붐비는 주말 그리고 최고절정의 시간에 방문했어요 맛있어요 익선동의 한 카페 맛이랑 똑같아서 맛있게 잘 마셨어요 그리고 제일 합리적인건 테이크아웃시 할인이에요 완전 최고 그리고 마지막으로 화장실 세정워시 향도 느므 쪼아요,0,1,0,0,1,0,0,0,0,1,0
18,아키비스트,아인슈페너 바닐라라떼 둘 다 맛있어요 개인적으로는 투고해서 근처 벤치 앉아 마시는게 더 운치 있고 좋았어요 투고하면 할인되는 줄 몰랐는데 할인은 덤 사장님도 친절해요,1,1,0,0,0,0,0,0,0,0,0
19,아키비스트,몇번 갔는지 카운트하기도 힘든 곳 차갑던 따뜻하던 마지막 모금까지 쫀쫀한 크림이 완벽한 아인슈페너는 이곳이 유일무이 베이커리 는 스콘이랑 레몬파운드가 최고 나머지는 평타이상,0,1,0,1,0,1,0,0,0,0,0
20,아키비스트,아인슈페너 진짜 맛은 있어요 웨이팅이 있었지만 그래도 테이크아웃하길 잘한것 같습니다 웨이팅 하는 시스템은 종이가 아니라 바 꿔야할것 같아요 테이크 아웃하면 할인도 적용도 해주고 날이 좋으면 매장이 아니더라도 괜찮을듯,0,1,0,0,0,0,0,0,0,0,0
21,아키비스트,아인슈페너 맛있었어요 아메리카노도 괜찮고 솔티드 카라멜 휘낭시에 먹었는데 그냥 휘낭시에도 먹어보고 싶어요,1,1,0,1,0,0,0,0,0,0,0
22,아키비스트,서울 대 아인슈페너 맛집이라고 해서 방문 해봤는데 진짜 맛있어요 매장 근처도 조용해서 테이크 아웃해서 먹기도 좋고 가게 자체 분위기도 좋아요,0,1,1,0,0,0,0,0,0,0,0
23,아키비스트,비주얼만으로도 특유의 쫀쫀한 크림이 느껴졌던 아인슈페너는 묵직하게 듬뿍 올라가 있는 크림이 엄청 꾸덕하고 진해 커피와 함께 먹지않고 크림만 먹는다면 목이 메이는 것처럼 느껴질 정도였어요 개인적으론 커피에 크림이 살짝 녹으며 어우러지는걸 좋아해 커피 자체가 부드럽고 고소한 맛이 많이 느껴져 진하게 마실 수 있었던 플랫 화이트가 더 맛있었던 것 같습니다,0,1,0,0,0,0,0,0,0,0,0
24,아키비스트,카페 이용 대기줄이 엄청 길어요 본인 기준 시간 분 대기 안내받았음 테이크아웃 해서 근처 바위에 앉아서 먹었습니다 주문 하고 분 분 기다린 것 같아요 아인슈페너 진짜 너무너무 맛있었어요 스콘은 평범했습니다 다음에도 근처 가게되면 재방문 할 것 같아요 개인적인 생각으로는 기다려서 먹을 가치가 있다고 생각합니다,0,1,0,0,0,0,0,0,0,0,0
25,서촌스코프,뭘 먹어야할지 몰라 베스트셀러로 골랐는데 진짜 너무 맛있네요 다 먹어보고 싶은데 사이즈가 커서 부라우니는 진해서 커피와 먹기 너무 맛있구영 오렌지 케이크는 달지 않고 맛있어요 스콘은 진짜 고소하고 진짜 맛있어용 자주 가야겠어요 한시간 걸리는 거리이지만 또 가야겟어요,0,1,0,1,0,0,0,0,0,0,0
26,서촌스코프,스코프 짱짱 헤이즐넛초코 스콘이랑 브라우니 샀는데 가격대비 퀄리티랑 크기가 아주 만족이예요 스콘은 사실 기대를 너무 많이 했는지 생각보다 그저 그랬는데 브라우니가 대박 완전 꾸덕꾸덕하고 반만 먹어도 당충전 빠박입니닷,0,0,0,1,0,0,0,0,0,0,0
27,서촌스코프,날씨 좋은날 라즈베리 아몬드 타르트 상큼한 라즈베리 아몬드 버터향의 조화 이거 맛있네요 밑에 타르트 쿠키의 바삭한 식감이 좋 아요 차갑게 드시는걸 추천해요,0,0,0,1,0,0,0,0,0,0,0
28,서촌스코프,버터가 많이 들어갔는지 조금 느끼한 감이 있는데 퍼석한 스콘 말고 이런 느낌의 스콘 좋아하시는 분들은 잘 맞을듯 해요 저는 물론 너무 좋아합니당,0,0,0,1,0,0,0,0,0,0,0
29,서촌스코프,수요미식회 버터스콘 구매하러 방문 촉촉하고 무겁지 않은 그리고 크기 정말 스콘계의 혁명임 혈당 올라가는 케이크류 나 버터바 등도 같이 있어 고르기 매우 힘이 듦 층은 제품 판매 및 제조 층에 취식 가능 사진처럼 제품이 그냥 쌓여있어 위생이 걱 정되긴 함 잘 보면 한쪽에 반값 할인하는 제품도 있으니 참고하세요,0,0,0,1,0,0,0,0,0,0,0
30,서촌스코프,헤이즐럿초콜렛스콘 꼭 드셔보세요 그 다음은 바나나 좋아하는 분은 바나나케익 맛보시길 층에 아담한 좌석도 있고 햇빛받으며 빵이랑 커피도 마실수 있어요 빵집 여기가 맛집,0,0,1,1,0,0,0,0,0,0,0
31,서촌스코프,친구 추천으로 처음 가봤어요 크기가 생각보다 커서 만족 맛도 만족 주말이라서 그런지 사람이 많았어요,0,0,1,0,0,0,0,0,0,0,0
32,서촌스코프,정말 맛있는 스콘을 맛볼 거 같아서 신나서 방문했던 곳이에요 그동안 먹었던 스콘이랑은 차원이 다르게 겉면이 아주 바삭바삭하고 속 은 시트처럼 푹신하네요 커피는 숨 맛 신맛 탐 맛 없이 깔끔하고 진한 맛이에요 아쉬운 점은 층이 규모가 작은데 인원이 꽉 차고 소리 가 울려서 너무 시끄러웠어요 포장해서 집에서 드시는 게 제일 좋은 방법을 듯 하네요,0,1,0,1,0,0,0,0,0,0,0
33,효자베이커리,콘브래드가 왜 베스트 위 템인지 한 입 먹자마자 납득이 딱 갑니다 고로케같은데 빵부분은 카스테라마냥 부드럽고 고로케라고하기엔 느끼하지 않은 내용물 증말 또 먹고싶네요 옛날호두타르트는 직원분 추천 받아서 샀는데 호두토핑이 넉넉하니 맛있었어요,0,0,0,1,0,0,0,0,0,0,0
34,효자베이커리,콘브레드 무화과빵 소금빵 개입 구매 서촌 갈 때마다 꼭 들려서 콘브레드 무화과빵 사옴 이 집만의 특별한 맛이 있는데 요새 빵집에선 안나는 맛이 참 묘함 소금빵도 촉촉계로 버터롤에 가까운데 안에 버터 덩어리가 안 녹아있음 젊은 사장님이 물려받으셨는지 몇 년 전부터 적극적으로 판매하심 가보면 어느 새 추천메뉴 사고있는 자신을 발견할 수도,0,0,0,1,0,0,0,0,0,0,0
35,효자베이커리,대표빵은 못 샀지만 오랜만에 가니 정감있고 좋네요 예전엔 젊은 남자 사장님이 안계셨던 것 같은데 파이팅 넘치고 친절하셔서 좋더라고요,1,0,0,0,0,0,0,0,0,0,0
36,효자베이커리,무화과빵이랑 깨찰빵 너무 맛있어요 위인 콘브래드는 오히려 제 입맛은 아니었어요 좀 느끼 고로케를 구운 느낌이고 안에 양파맛이랑 크림맛만 났어요 다른 빵은 다 맛있어요 붓세도 부드럽고 향긋,0,0,0,1,0,0,0,0,0,0,0
37,효자베이커리,대한민국에 몇 없는 빵 명장이 운영하는 곳이다보니 빵 맛은 말모말모 그리고 다른 빵 명장이 운영하는 빵집보다 가격도 좀 저렴함 콩 식빵 구매했는데 너무 맛있고 수제 양갱도 구매해 봄 다른 사람들 다 사는 콘브래드는 안샀지만 무화과빵 사봤는데 이것도 너무 맛있 음 아 그리고 스탭분이 사장님이신가 친절하다 못해 스윗해서 심쿵할 정도,1,0,0,1,0,0,0,0,0,0,0
38,효자베이커리,진짜 천원이라는 가격이 안 믿기는 맛과 양이에요 대표 메뉴 꼭 드셔보세요,0,0,0,1,0,0,0,0,0,1,0
39,효자베이커리,콘브레이드 너무 맛있어요,0,0,0,1,0,0,0,0,0,0,0
40,효자베이커리,먹음직하게 생긴 독특한 생김새 맛난 빵을 맛 볼수 있는 집,0,0,0,0,0,0,0,0,0,0,0
41,효자베이커리,무화과 크림치즈빵 맛있어요,0,0,0,1,0,0,0,0,0,0,0
42,카페이마,정말 와플은 여기가 최고에요 부드럽고 촉촉하구 위에 올라간 아이스크림도 쫀득하니 맛있어요,0,0,0,1,0,0,0,0,0,0,0
43,카페이마,건강한 맛의 함박스테이크 예요 집에서 정성스레 만든 음식같아 맛있게 먹었어요 채소 잘 먹는데도 소스에 양파가 너무 많이 들어 있는 건 좀 부담스러웠어요,0,0,0,0,0,0,0,0,0,0,0
44,카페이마,커피 산미조금있지만 풍미가득 와플 맛있고 함박스테이크가 메인인곳 다시 꼭 와보고싶은곳 화장실 청결하고 매장도 조용한 편,0,1,0,1,1,0,1,0,0,0,1
45,카페이마,아이스크림 와플 맛있어요,0,0,0,1,0,0,0,0,0,0,0
46,카페이마,그냥 클래식함박 그대로임 양이 결코 많지 않은 다른 테이블은 남기던데 왜지 에이드 시켰는데 그냥 사이다 써서 인위적 단맛에 실망 꼭 먹겠다면 레몬 오렌지,0,0,0,0,0,0,0,0,0,0,0
47,카페이마,밥이 먹고 싶을 때 가도 좋고 디저트가 생각날 때 가도 좋고,0,0,0,1,0,0,0,0,0,0,0
48,카페이마,베이클에 크림치즈 많이줘서 넘 좋아요,0,0,0,1,0,0,0,0,0,0,0
49,인왕산 대충유원지,엄마와 방문했는데 여러모로 만족스러웠습니다 거봉녹차는 이름답게 거봉향이 그득히 올라와서 좋네요 마치 가벼운 봉봉을 마시는 느낌 테라스도 있는데 인왕산을 배경으로 사진찍기도 좋아서 정말 추천합니다 감사히 잘 마셨습니다,0,0,0,1,0,1,0,1,1,0,0
50,인왕산 대충유원지,서촌 한옥 풍경이 내려다 보이는 뷰를 가진 카페 카페 안은 약간 바 같은 분위기에 한옥느낌을 살짝 첨가한 느낌입니다 커피를 바로 눈앞에서 내려주시는데 직접 보는 재미도 있고 커피맛도 좋습니다 적당한 가격에 위스키들도 구비해놓고 있는데 커다란 사운드에서 나오는 음악과 즐기기엔 딱 좋을 듯 합니다 조금 좁은게 아쉽지만 데이트 코스로도 정말 좋은 느낌,0,1,1,0,0,0,0,0,1,0,1
51,인왕산 대충유원지,연남동과는 또 다른 분위기라 좋았던 인왕산 대충유원지,0,0,0,0,0,0,0,0,0,0,0
52,인왕산 대충유원지,독특하고 신기하고 재미난 공간이었어요 달달한 밀크향이 나는 차도 좋았고 달달 든든한 미숫가루도 좋았고요 친절한 서비스도 좋았 어요,1,0,0,0,0,1,0,0,0,0,0
53,인왕산 대충유원지,생각보다 많이 좁아요 음료값 비쌈 뷰는 좋음,0,0,0,0,0,0,0,0,1,0,0
54,인왕산 대충유원지,서촌중에 제일 분위기 좋은 카페인것 같아요 저만 알고 싶은 카페 최고입니다,0,0,1,0,0,0,0,0,1,0,0
55,인왕산 대충유원지,커피보다 호지차가 맛잇어요 내부가 시끄럽고 주말 오후 웨이팅이 잇어요,0,0,0,0,0,1,0,0,0,0,0
56,스쿠퍼젤라또,왜 이제야 왔는지 스스로 후회가 될 정도로 너무 맛있었어요 이탈리아에서 먹었던 바로 그 맛리라 먹으면서 너무 반갑고 기분 좋았습니다 위치도 아이스크림 한 컵 들고 서촌 산책하기 딱 좋은 위치입니다,0,0,0,1,0,0,0,0,0,0,0
57,스쿠퍼젤라또,맛나요 바질민트 이탈리아 피스타치오 인기 있을만 합니다 제일 많이 나갔더라두요 역시 두개가 진짜 맛있어요 맛보기 스푼으로 먹은 패션후르츠도 상큼해서 좋더라구요 원에 젤라또 이정도면 가성비 좋다고 생각해요,0,0,0,1,0,0,0,0,0,1,0
58,스쿠퍼젤라또,서촌 스쿠퍼 유명한건 다 아시겠지만 정말 너무 맛나요 엄마도 모시고 왔는데 넘 만족하셨어요 매일 바뀌는 메뉴도 시즌 메뉴도 달라지는게 넘 독특하고 신선해서 좋아요 다음엔 또 다른맛 먹으러 가야쥐,0,0,0,0,0,0,0,0,0,0,0
59,스쿠퍼젤라또,고소한 맛으로만 선택했는데 다 맛있어요 앞 매장때문에 영향 받으실텐데 사장님이 참 친절하셨어요,1,0,0,1,0,0,0,0,0,0,0
60,스쿠퍼젤라또,동네라 자주 방문하는데 맛있어요 바질우유 백향과 진짜 맛있어요,0,0,0,1,0,0,0,0,0,0,0
61,스쿠퍼젤라또,다맛있는데 초콜렛 진짜 진하고 맛있어요 우유초코칩이 진짜 제수탈입니다,0,0,0,0,0,0,0,0,0,0,0
62,스쿠퍼젤라또,세가지 맛의 젤라또를 한번에 맛볼 수 있어서 좋았습니다,0,0,0,0,0,0,0,0,0,0,0
63,스쿠퍼젤라또,패션후르츠맛 최고에염 젤라또 넘 맛있고 직원분도 친절하세요,1,0,0,1,0,0,0,0,0,0,0
64,스쿠퍼젤라또,수박맛 젤라또 먹어봤는데 맛있어서 다른 맛도 궁금해졌어요,0,0,0,1,0,0,0,0,0,0,0
65,통인동커피공방 위켄드,매장도 밖에서 본거보다 넓직하거 스탭분도 매우 친절하게 이벤트 하는거 알려주시고 그랬어요 에스프레소빈도 둘중에 선택할수있어서 좋았어요,1,0,1,0,0,0,0,0,0,0,0
66,통인동커피공방 위켄드,브라우니가 맛있네요 커피도 디카페인 선택 할 수 있고 우유도 선택할 수 있어서 좋았습니다 조금 바쁜시간에 가서 그런지 실수가 많 았는 점은 조금 아쉬워요,0,0,0,1,0,0,0,0,0,0,0
67,통인동커피공방 위켄드,주인장께서 커피 콩을 최상으로 커피맛,0,1,0,0,0,0,0,0,0,0,0
68,통인동커피공방 위켄드,음료가 비싼 편이지만 가게가 예쁘고 분위기 좋아요,0,0,1,0,0,0,0,0,0,0,0
69,통인동커피공방 위켄드,통인시장 구경갔다가 들렸어요 딸기주스 엄청 맛있어요,0,0,0,0,0,1,0,0,0,0,0
70,통인동커피공방 위켄드,커피가 넘맛나요 봄 넘생각날 듯,0,1,0,0,0,0,0,0,0,0,0
71,통인동커피공방 위켄드,친절하세요 듣던대로 커피맛도 깔끔하고 좋네요 날씨가 더워서 흡입하듯 마셨엉요,1,1,0,0,0,0,0,0,0,0,0
72,통인동커피공방 위켄드,한 잔은 적고 두 잔은 많은 맛있는 커피 따로 파시는 원두도 좋고 향도 좋아요 에스프레소가 천원 가격만 조금 더 착하면 좋겠다,0,1,0,0,0,0,0,0,0,0,0
73,myc,새로 나온 디저트 크러핀 처음 먹어보는건데 적당히 달면서 되게 맛있네요 커피랑 잘 어울려요 개인적으로 서촌에서 가장 커피메뉴들이 맛있는 카페에요,0,1,0,1,0,0,0,0,0,0,0
74,myc,친절하고 커피도 맛있어요,1,1,0,0,0,0,0,0,0,0,0
75,myc,코리아노 미숫가루 베이스 커피로 고소하고 특이하고 맛있네요,0,0,0,0,0,1,0,0,0,0,0
76,myc,코리아노 맛나고 스티키파이 요거 이게 진짜 식감도 맛도 지기네요 찹쌀떡 같은 친구인데 아기자기한 게 맛은 으른이네요,0,0,0,1,0,0,0,0,0,0,0
77,myc,카페인 없는 밀크티가 매우 맛있었다 펄 추가 있음 하고 싶었다 브라우니는 단 걸 못 먹는 내겐 너무 달았으나 친구들은 대만족,0,0,0,1,0,1,0,0,0,0,0
78,myc,스티키파이랑 플랫화이트 최고에요,0,1,0,1,0,0,0,0,0,0,0
79,myc,지나가다 테이크아웃 했는데 커피 정말 맛있게 마셨습니다,0,1,0,0,0,0,0,0,0,0,0
80,모드니에,파리브레스트 사러 방문 프랑스 디저트가 주를 이루는 작은 가게로 다양한 메뉴들이 있고 피스타치오크림이 얀 보다 덜 달아서 좋음 헤이즐넛 크림이면 더 좋았겠지만 다음에 다른 메뉴도 도전해보고 싶음,0,0,0,1,0,0,0,0,0,0,0
81,모드니에,프랑스디저트들을 다양하게 먹을수있어서 좋았어요 마들렌은 모두 글레이즈가 되어있어서 촉촉했지만 살짝 제 입엔 달았고 휘낭시에와 까눌레는 맛있었어요 새로운 모양의 플로랑탱도 맛있었어요,0,0,0,1,0,0,0,0,0,0,0
82,모드니에,까눌레 휘낭시에 식감 미쳤 감태 누룽지휘낭시에 메뉴가 특별해서 넘 좋았어요 레몬 마들렌도 맛있었어요 페스츄리를 너무 좋아해서 크로와상 뺑오쇼콜라도 구입했는데 페스츄리는 솔직히 좀 그 외에 구움과자류는 다 맛있어서 다음에 또 구입하려고요,0,0,0,1,0,0,0,0,0,0,0
83,모드니에,마들렌이 촉촉하고 넘나 맛잇어요 커피도 맛잇음,0,1,0,1,0,0,0,0,0,0,0
84,모드니에,구움과자랑 빵좋아하는분 근처오면 꼭방문해보세요 좌석은 테이블 개라 거의테이크아웃 위주인데 감태휘낭시에랑 누룽지휘낭시에 같이 처음 보는거있어서 먹어봣는데 존맛탱 피칸마들렌도 맛나고 다맛나보여서 혼날뻔 다음에또갈거에요,0,0,0,1,0,0,0,0,0,0,0
85,모드니에,마들렌이 촉촉하고 맛있어요,0,0,0,1,0,0,0,0,0,0,0
86,모드니에,마들렌이랑 까눌레처럼 작고 아담한 맛있는 빵이 많아요 커피를 앉아서 먹기에는 매장이 협소해요 그래서 포장하는 손님들이 많더라구요 저희는 잠시 앉았다갔는데 너무 맛있게 먹고 갔습니다,0,0,0,0,0,0,0,0,0,0,0
87,모드니에,빵맛있다고 친구가 강추해서 갔는데 빵은 맛있어요 근데 여자직원분 불친절해요 기분 안좋으셨나요 오늘 하루 기분 안좋아서 불친절했던 거라 생각할게요 서비스 생각하면 다신 가고싶지 않고요 굳이 찾아와서 리뷰를 적게 되네요 진짜 눈으로 싸울뻔했어요 서비스에 신경 좀 쓰시길 바라요,0,0,0,1,0,0,0,0,0,0,0
88,모드니에,담백하니 맛있어요 마들렌이랑 마카롱만 구매 했는데 다른 디저트들도 사보고 싶어요,0,0,0,1,0,0,0,0,0,0,0
89,롤로도넛,와 진짜 세가지 다 맛있어요 레몬크림도넛이 진짜 최고로 맛있구요 트로피칼 어쩌구 도넛은 의외로 너무 맛있어요 무슨 잎사귀 들어있는것도 굉장히 상큼하고 잘 어울립니다 발로나초코 라즈베리는 초코와 라즈베리 조합이 아주 잘어울리고 초코도 고급진 맛이라 제가 고른 메뉴가 아니지만 맛있게 먹었습니다 재방문의사 있습니다,0,0,0,1,0,0,0,0,0,0,0
90,롤로도넛,먹어보고 깜짝 놀라 이번에는 리뷰 남깁니다 빵이 촉촉하고 쫄깃하니 완전 맛있어요 레몬크림은 진짜 상큼하고 애플시나몬은 전 자레인지 살짝 돌려서 아메리카노랑 먹으니 세상 맛있네요 맛난 도넛집 알게 돼서 기뻐요 서촌 갈때는 꼭 롤로도넛 들릅니당,0,1,0,1,0,0,0,0,0,0,0
91,롤로도넛,도넛도 맛있고 커피도 맛있어요 어떤 도넛이든 던킨보단 다 맛있어요 던킨은 솔직히 편의점 도넛만도 못하다는,0,1,0,1,0,0,0,0,0,0,0
92,롤로도넛,포장도 꼼꼼하게 해주시고 도넛도 엄청 맛있네요 개인적으로는 크랜베리,0,0,0,1,0,0,0,0,0,0,0
93,롤로도넛,신선한 도넛 이젠 날이 더워 코팅이 녹으니 드시고 가세요,0,0,0,1,0,0,0,0,0,0,0
94,롤로도넛,아메리카노는 보통이고 블루베리 크림치즈 크림 가득이에요 굿,0,0,0,1,0,0,0,0,0,0,0
95,롤로도넛,북촌에 있는 노티드나 랜드스가 있다면 서촌에는 롤로가 있다고 생각합니다 매장이 작아 앉을 수 있는 자리가 적은게 단점이지만 도넛 정말 맛있고 커피도 맛있습니다 매장도 이쁘게 잘 꾸며져서 사진도 이쁘게 나옵니다 크랜베리 크림도넛 맛있어서 추천하고 싶습니다,0,0,0,1,0,0,0,1,0,0,0
96,롤로도넛,도넛 하나 먹고 미국인줄 프랑스밀가루로 만든 발효도우 맛이 없을 수 없음 지나가면서 커피랑 도넛 꼭 드셔보세요,1,0,0,1,0,0,0,0,0,0,0
97,롤로도넛,초코가 생각보다 안달아서 좋아요,0,0,0,0,0,0,0,0,0,0,0
98,뮬랭 듀 몽드,밀가루 빵이 아닌 쌀가루로 만든 쌀빵이 정말 맛있는 곳입니다 쌀이다보니 소화가 더 잘 되는 듯해요 찹쌀타르트도 쫄깃한게 너무 맛있어요 사장님도 너무 친절하시고 좋아요,1,0,0,1,0,0,0,0,0,0,0
99,뮬랭 듀 몽드,빵은 쌀로 만들어서 사이즈는 다소 작으나 맛은 굿굿 완전 쫀쫀 담번에는 치즈랑 다른 식빵들도 도전하고 싶어요 가격은 조금 있는 편,0,0,0,1,0,0,0,0,0,0,0
100,뮬랭 듀 몽드,엄마 아빠도 담백하다고 하시며 맛있게 드셨습니당 너무 맛있어서 그 자리에서 순삭했어요 또 방문할게요 더더더 번창하세요,0,0,0,1,0,0,0,0,0,0,0
101,뮬랭 듀 몽드,오잉 쿠키는 어떻게 받는건가요 안주시던데 나트륨 없는 쌀식빵이라 너무 좋아요,0,0,0,0,0,0,0,0,0,0,0
102,뮬랭 듀 몽드,쌀로 만든 빵과 디저트 파는 곳입니다 방부제 표백제 유화제가 없다고 하네요,0,0,0,0,0,0,0,0,0,0,0
103,뮬랭 듀 몽드,쌀식빵이라 그런지 쫄깃쫄깃하고 맛있네요,0,0,0,1,0,0,0,0,0,0,0
104,뮬랭 듀 몽드,통팥앙 새로 나왔다고 사서먹었는데 정말 돈 아까웠어요 쌀빵이라하지만 빵부분은 다 버리고 쌀빵만 찾아 먹는데 이곳은 절대 추 천못하겠어요 맛이 너무 달고 그렇다고 건강한맛도 아니고 비추 정말 빵사서 거의 다 버린건 처음,0,0,0,0,0,0,0,0,0,0,0
105,뮬랭 듀 몽드,쌀식빵 조아요 가격대는 있지만 식빵 원 좋은재료니까요,0,0,0,0,0,0,0,0,0,0,0
106,피오르,이탈리아가 생각나는 맛이에요,0,0,0,0,0,0,0,0,0,0,0
107,피오르,평소에도 종종 먹었지만 리뷰는 처음이네요 그린 토마토와 빈투바 초콜릿 먹었는데 정말 맛있었어요 장미가 없어져서 아쉬웠는데 앞으론 이거 먹어야겠어요,0,0,0,1,0,0,0,0,0,0,0
108,피오르,맛있고 친절해요오오오,1,0,0,0,0,0,0,0,0,0,0
109,피오르,맛있음 좁지만 층에 먹고 갈 수 있는 좌석 있음,0,0,0,0,0,0,0,0,0,0,0
