,cafe,review,친절해요,커피가 맛있어요,인테리어가 멋져요,디저트가 맛있어요,매장이 청결해요,음료가 맛있어요,대화하기 좋아요,사진이 잘 나와요,뷰가 좋아요,가성비가 좋아요,집중하기 좋아요
3210,온혜화,멋진 경관과 열쇠 도자기 차 관람 넘좋아요,0,0,0,0,0,0,0,0,1,0,0
3211,온혜화,서울야경이 끝내줘요 분위기도좋아요,0,0,1,0,0,0,0,0,1,0,0
3212,개뿔,인스타에서 본 메뉴가 없길래 시그니처 뭐냐고 물어보니 그런거 없다고 하시고 없어졌으면 없어졌다고 설명을 해주셨음 좋았겠네요,0,0,0,0,0,0,0,0,0,0,0
3213,개뿔,무채색 카페 분위기 넘모 힙하고 좋아요 특히 브라우니 너무 맛있어서 순삭하고 한 번 더 먹었어요,0,0,0,1,0,0,0,0,0,0,0
3214,개뿔,커피도 디저트도 맛있어요,0,1,0,1,0,0,0,0,0,0,0
3215,개뿔,사장님 친절하시고 커피랑 디저트 맛있어요,1,1,0,1,0,0,0,0,0,0,0
3216,개뿔,분위기 커피 맛 모두 좋았어요 음악도 완전 제 취향,1,1,0,1,0,0,0,0,0,0,0
3217,개뿔,밀크티 맛있음 인테이어 이뿜 카페 조용한 분위기가 아니고 와이파이가 자꾸 끊겨요,0,0,1,0,0,1,0,0,0,0,0
3218,개뿔,시그니처 메뉴 릴랙스커피 맛있고 카페 깔끔해서 제 취향,0,1,0,0,1,0,0,0,0,0,0
3219,릴랙스 인 다운타운,옛날 아베크엘자리 예전보다 조금 더 프렌치 앤틱 감성이 묻어나와요 디저트는 완전히 프렌치 스타일이라기 보다는 프렌치 일본 한국 느낌이고 무난하게 맛있습니다 대학로 특유의 감성 좋아하시는 분들 빨간 벽돌 사이의 조용한 주택가 그리고 창밖으로 보이는 눈부시는 봄과 여름들 초록색을 느끼기 좋아요,0,0,0,1,0,0,0,0,0,0,0
3220,릴랙스 인 다운타운,토요일 저녁에 방문했는데 여기 분위기 미쳤어요 너무예뻐요 흑흑 디저트 먹고싶은애들 은 다 품절 솔티카라멜 파 운드먹었는데 고급스런 맛이어써용 행복한시간보내고와써요 히히,0,0,1,1,0,0,0,0,0,0,0
3221,릴랙스 인 다운타운,인테리어가 넘 예쁘고 디저트가 가격대는 있지만 아주 맛있어요 아이스 아메리카노는 무난했어요,0,0,1,1,0,0,0,0,0,0,0
3222,릴랙스 인 다운타운,디저트가 먹고 싶으면 라뚜셩트만한 곳이 없어요 케이크 가격대가 있긴 하지만 그만큼 맛있는 곳이에용 밀크티랑 유주랑 샤를로트 유주 추천합니다,0,0,0,1,0,1,0,0,0,0,0
3223,릴랙스 인 다운타운,종로로 옮긴다음에 첨 가봤는데 인테리어 대박이에요 완전 유럽 안가봤지만 여유로운 느낌으로 사진 넘 잘 나오고 디저트도 역 시 굿굿 저거 휘낭시에였나 겉바속촉 쫀득 쩔탱 맛있었다는 뜻 입니다,0,0,1,1,0,0,0,1,0,0,0
3224,릴랙스 인 다운타운,분위기 좋고 인테리어 좋고 라뚜셩트만의 독특한 디저트도 맛볼 수 있어서 좋았어요 직원분들도 친절하셨고 좌석도 많고 널찍해서 굿 시그니쳐 비비피앙은 라즈베리의 새콤달콤함과 요거트의 가볍고 시콤한 맛이 물씬나는 맛이었어요 완전 제 입 맛이었던 아메리카노는 씁쓸한 맛이 많이 느껴져서 저는 좋았답니당 밍밍하고 묽은 맛 좋아하시면 다른 음료를 시켜보세요,1,1,1,1,0,0,0,0,0,0,0
3225,릴랙스 인 다운타운,분위기 좋아요 구석진 곳이라 좋아요,0,0,1,0,0,0,0,0,0,0,0
3226,릴랙스 인 다운타운,솔티카라멜 맛있어요 커피는 마실수록 써지고 아인슈페너는 너무 달아요,0,1,0,0,0,0,0,0,0,0,0
3227,릴랙스 인 다운타운,조용히 얘기 할 수 있어서 너무 좋았어요,0,0,0,0,0,0,1,0,0,0,0
3228,라뚜셩트,다른곳 까눌레보다 부드럽고 맛있어요,0,0,0,1,0,0,0,0,0,0,0
3229,라뚜셩트,저녁먹고 후식마시고 늦게 갔더니 마지막 남은 까눌레 종세트 천원 만원이상구매시 쿠폰도장 그래서 업어온 크림치즈 레드벨벳 쿠키까지 포장만 가능해요,0,0,0,0,0,0,0,0,0,0,0
3230,라뚜셩트,겉은 바싹 속은 촉촉 가성비가 좋아요,0,0,0,1,0,0,0,0,0,1,0
3231,라뚜셩트,브라우니 달고 묵직한 맛,0,0,0,1,0,0,0,0,0,0,0
3232,라뚜셩트,말해모해 존맛 케이크는 달지 않으면서도 초코맛이 진하게 나서 좋았구요 초코쿠키도 마찬가지였어요 식감도 바삭하니 아주 맛있 었습니다 얼그레이 파운드 케이크는 부드러워서 목막히는 식감이 아니라서 좋았어요 무화과 휘낭시에는 무화과가 큼지막하게 들어 가서 씹는 맛이 있었습니다 또 사먹으러 갈게여,0,0,0,1,0,0,0,0,0,0,0
3233,라뚜셩트,진짜 맛있네요 사장님 화이팅,0,0,0,1,0,0,0,0,0,0,0
3234,라뚜셩트,까눌레 말고도 마들렌이랑 휘낭시에도 정말 맛있어요,0,0,0,1,0,0,0,0,0,0,0
3235,라뚜셩트,까눌레 향긋하고 빠삭촉촉해요 맛있어요,0,0,0,1,0,0,0,0,0,0,0
3236,라뚜셩트,까눌레가 너무 맛나요 속이 촉촉하고 얼른 또 사먹고 싶어요,0,0,0,1,0,0,0,0,0,0,0
3237,헤이스윗,인테리어도 너무 예쁘고 아인슈페너 진짜 맛있어요 그리고 디저트들이 다 예뻐서 선물하기 좋은 것 같아요,0,1,1,0,0,0,0,0,0,0,0
3238,헤이스윗,그냥건물 층카페인데 화이트컬러라서 분위기 짱좋아요,0,0,1,0,0,0,0,0,0,0,0
3239,헤이스윗,디저트들이 질리지 않고 너무 맛있어요,0,0,0,1,0,0,0,0,0,0,0
3240,헤이스윗,매장이 깨끗하고 사장님 친절하세요,1,0,0,0,1,0,0,0,0,0,0
3241,이유유 커피,분위기가 너무 좋아요 드립만 있는 곳은 처음인데 너무 맛있네요 치즈케이크 부드럽고 맛있고 과일이 너무 신선해요,0,0,1,1,0,0,0,0,0,0,0
3242,이유유 커피,공간이 너무 예뻐서 좋아요 시간을 되돌릴 수 있다면 여기 매일 오고싶네요,0,0,1,0,0,0,0,0,0,0,0
3243,이유유 커피,부늬기 좋아용 아마춰작업실,0,0,1,0,0,0,0,0,0,0,0
3244,이유유 커피,카페 내부 공간이 넓고 앉을 자리가 많아요 내부에 나무로 이루어진 공간이 많아 너무 예쁘고 인상 깊었어요 원두 종류가 다양해서 골 라 먹는 재미가 있을 것 같구 얼그레이 밀크티는 홍차 맛이 많이 난다기 보단 누룽지 맛 사탕 향이 나요 전 근데 그게 좋았습니다 얼그레이 밀크티를 추천드려요,0,0,1,0,0,1,0,0,0,0,0
3245,이유유 커피,행복한 하루를 보낼 향기가 나는 카페네요 카페 고민 이라면 너무 좋아요 강추,0,0,0,0,0,0,0,0,0,0,0
3246,이유유 커피,커피도 맛있고 케이크가 너무 맛있었어요 여러분 치즈케이크 딸기맛 꼭 드세요 종로 가 숨은 핫플이에요 인테리어도 고즈넉해서 너무 예뻤네요,0,1,1,1,0,0,0,0,0,0,0
3247,이유유 커피,카페 분위기가 멋지네요 나중에 저녁때 와인 마시러 다시 한번 오고 싶어요,0,0,1,0,0,0,0,0,0,0,0
3248,이유유 커피,분위기부터 지림 커피도 디저트도 맛있어요,0,1,1,1,0,0,0,0,0,0,0
3249,이유유 커피,치즈케익 너무 맛있어요 포장이 선물받난 것처럼 되어있어서 기분두 좋고 치즈도 입에서 사르르 녹고 너무 맛있어요,0,0,0,1,0,0,0,0,0,0,0
3250,아마츄어작업실 광장시장점,분위기가 너무 좋고 싱그럽네요 음료양도 꽤많습니다,0,1,1,0,0,0,0,0,0,0,0
3251,아마츄어작업실 광장시장점,공간이 넓고 작업하기 좋아요 가격이 비싸지만 그래도 맛있습니다 굿굿,0,0,1,0,0,0,0,0,0,0,0
3252,아마츄어작업실 광장시장점,아이스라떼는 원입니다,0,0,0,0,0,0,0,0,0,0,0
3253,아마츄어작업실 광장시장점,카페는 쾌적하고 좋아욤,0,0,1,0,0,0,0,0,0,0,0
3254,아마츄어작업실 광장시장점,다 맛있어요 자주이용함다,0,1,0,1,0,0,0,0,0,0,0
3255,D CAFE 동대문점,강아지와 출입이 가능 루프탑만 몇 안되는 카페 쿠키와 휘낭시에 존맛 그리고 아직 팔진 않는 메뉴인 치즈케익은 더존맛 얼른 팔아주세요,0,0,0,1,0,0,0,0,0,0,0
3256,D CAFE 동대문점,커피도 저렴하구 야외석도 있어요 스모어 쿠키 맛있숴유 잠깐 들려서 쉬기좋아요 가성비가 최고여요,0,0,0,1,0,0,0,0,0,1,0
3257,D CAFE 동대문점,커피 음료 쿠키 맛있어요 예쁜 인테리어와 친절함은 덤 잘 쉬다 왔습니다,1,1,1,1,0,1,0,0,0,0,0
3258,D CAFE 동대문점,뷰가 좋고 특히 음료가 맛있었어요,0,0,0,1,0,1,0,0,0,1,0
3259,D CAFE 동대문점,휘낭시에 맛나용 커피는 쏘쏘 너무 연해요,0,0,0,1,0,0,0,0,0,0,0
3260,D CAFE 동대문점,커피가 맹맛이지만 분위기 좋아요,0,0,1,0,0,0,0,0,0,0,0
3261,D CAFE 동대문점,뷰도 너무 좋고 루프탑도 있는 카페 안에 연뮤 플북도 있고 오슷도 있는 걸 보아하니 사장님도 연뮤덕이신가 싶었어요 아아메 싸고 맛있어요,0,1,0,0,0,0,0,0,1,1,0
3262,인터미션,카라멜치즈크로플이 달지 않으면서도 맛있어요 아이스아메리카노는 진해서 좋아요 매장도 넓고 쾌적해요,0,1,1,1,0,0,0,0,0,0,0
3263,인터미션,갈 때마다 모든 직원들이 바뀌어도 다 적당한 정도의 친절함 스윗함이 있어서 너무 기분 좋아지는 카페예요 커피도 양이 많고 맛있어서 저렴이 테이크아웃 커피 전문점보단 비싸지만 가성비 좋다는 생각이 듭니다,1,1,0,0,0,0,0,0,0,1,0
3264,인터미션,크로플 맛있어요 바질이 생각보다 향이 세서 무난하게는 카라멜치즈 너무 맛있고 바질은 독특하게 맛있어요,0,0,0,1,0,0,0,0,0,0,0
3265,인터미션,여기 크림밀크티 진짜 미친놈이에요 카공 장소로도 괜찮습니다,0,1,0,0,0,0,0,0,0,0,1
3266,타스카페,사장님도 친절하셔서 디저트 맛이 더 올라가는 느낌 헤이커피 아이스에 완전 반했어요,1,1,0,1,0,0,0,0,0,0,0
3267,타스카페,흑임자케이크가 존맛탱이라고 해서 먹어봤는데 진짜 꼬소 하고 빵도 촉촉한게 진짜 존맛탱구리입니다 버터스카치라떼도 스카치 캔 디 좋아하는 사람은 무조건 좋아할 맛 이집 맛 밸런스 천재예요,0,0,0,1,0,0,0,0,0,0,0
3268,타스카페,사장님 너무 친절하고 디저트 맛있고 좋아요 재방문의사 프로요,1,0,0,1,0,0,0,0,0,0,0
3269,타스카페,흑임자케이크 너무 맛있어요 마리아쥬 티브랜드 사용해서 홍차랑 캐모마일 모두 맛 좋아요 저녁식사 전 왔다가 자리가 없어서 저녁먹고 다시 왔는데 창가쪽 자리 하나 남아서 겨우 앉았어요 인테리어도 이쁘고 분위기 아늑해요 대학로 올때마다 또 방문해서 다른 디저트와 음료도 먹어보고 싶어요,0,0,1,1,0,0,0,0,0,0,0
3270,타스카페,무난합니다 자리가 붙어있어서 코로나 무섭네요,0,0,0,0,0,0,0,0,0,0,0
3271,타스카페,맛은 물론이며 분위기까지 취저입니다 또 방문 할꺼에요,0,0,1,0,0,0,0,0,0,0,0
3272,타스카페,쑥 갸또 맛있고 음료도 좋았어요 얼그레이 레몬티에 레몬청이 들어가는거 같은데 맛있더라구요 버터스카치라떼 는 엄청 달달하긴 한데 맛있어요,0,0,0,0,0,1,0,0,0,0,0
3273,타스카페,딸기케이크가 완전 맛있어요 시트는 촉촉하고 딸기는 푸짐하고 얼그레이티도 너무 달지 않고 딱 맛있었어요 사진찍기도 너무 좋고 매장도 넓어서 쾌적했어요 다음에 또 올게요,0,0,1,1,0,0,0,1,0,0,0
3274,타스카페,분위기가 따뜻하고 좋아요 디저트도 맛있고 친절하셔서 좋았어요,1,0,1,1,0,0,0,0,0,0,0
3275,헤이커피,혜화에서 제가 제일 좋아하는 카페입니다 자주 갔는데 이제야 리뷰를 쓰네요 낮엔 카페 밤엔 와인바 느낌이에요 블루룸은 아인 슈페너랑 딸기케익이 맛있지만 또 밤에 밤에 와인이나 맥주 한 잔 해주면 최고 낮이든 밤이든 과제나 작업도 잘돼요 포트와인 강 추합니다 하우스와인도 다른데보다 맛나요 가까우신 분들 짱 부러워요,0,1,0,1,0,0,0,0,0,0,1
3276,헤이커피,와 커피 진짜 최고입니다 꼭꼭 방문하세요,0,1,0,0,0,0,0,0,0,0,0
3277,헤이커피,치즈케이크 너무 부드럽고 맛있는데 차가 너무 달아요 카모마일 맛은 거의 안 나고 과일차같음 그리고 저녁에 너무 어둡게 해두심 분위기는 좋음,0,0,1,1,0,0,0,0,0,0,0
3278,헤이커피,친구와 이야기하러 가기도 혼자 조용히 있기도 좋은 블루룸 적당히 달달한 포트와인에 아주 많은 견과류 안주 최고 견과류 완전 많이 주셔서 다 채 다 못먹었지만 급 땡겨서 시킨 초코딸기케이크는 역시 맛있었다 단기간에 뚝딱하고 없애버렸다 한 네 입에 다 먹은 듯 넘 빨리 없이버려서 쪼금 부끄러울 지경이었다 블루룸 얼른 또 가구싶다 맛있는것들,0,0,0,1,0,0,1,0,0,0,1
3279,헤이커피,분위기가 엄청 좋아요,0,0,1,0,0,0,0,0,0,0,0
3280,콩툰 대학로점,친구 생일 파티용으로 주문했는데 디자인도 의도한 대로 예쁘게 잘 나왔고 케이크도 맛있었습니다 크림층이 얇아 느끼하지 않고 속에도 크림치즈가 들어서 좋았어요 상담도 너무 친절하게 받아주셔서 정말 만족스러웠습니다 앞으로도 자주 들리겠습니다,1,0,0,1,0,0,0,0,0,0,0
3281,콩툰 대학로점,지인이 여기서 두번이나 케잌을 선물해주었는데 너무 맛있고 케잌이 귀여워서 받았을 때 기분이 좋았던게 생각나서 친구생일케잌 선물용으로 주문하게 되었습니다 친구도 맘에 들어하고 소개도 해들라고 해서 소개했어여 번창 셨으면 좋겠어요,0,0,0,1,0,0,0,0,0,0,0
3282,콩툰 대학로점,케이크가 너무 예뻐요 다음에 또 이용하고싶어요,0,0,0,1,0,0,0,0,0,0,0
3283,콩툰 대학로점,처음가봤는데 청년몰안에있었네요 친절하세용,1,0,0,1,0,0,0,0,0,0,0
3284,콩툰 대학로점,사위생일케익 샀어요,0,0,0,0,0,0,0,0,0,0,0
3285,콩툰 대학로점,색이 아쉬웠지만 맛있어요,0,0,0,1,0,0,0,0,0,0,0
3286,강아지대학로,와플이 너무 마쉿엇다 와플맛집 다 먹어가는데 창문도 열어주셧다 뷰맛집 요즘같은 날씨에 너무 좋네여 직원분이 매우 친절하심 약간 배우 누구 닮으신듯 아 오레오쉐이크가 지대 마쉿다 담에 오면 또 오쉐 시켜야지,1,0,0,1,0,1,0,0,1,0,0
3287,강아지대학로,홍차는 그냥 그랬고 실론 마심 그린티트라이앵글이 맛있어요 녹차맛 향은 약한데 촉촉하고 사이사이에 팥이 잘 어울립니다 결제부터 서빙 다 해주셔서 편하고 자리도 폭신해요,1,0,0,0,0,1,0,0,0,0,0
3288,강아지대학로,동생이 데려가줘서 처음 방문해보았는데 맛도 좋고 뷰도 넘넘 좋았어요 혜화에 이런 카페가 있었다니 주류도 팔아서 정말 좋더라구요 직원 분들도 친절하셔서 재방문 각입니다,1,0,0,0,0,0,0,0,1,0,0
3289,강아지대학로,공간이 예뻐요 하겐다즈 아이스크림 쓰는것도 좋구,0,0,1,0,0,0,0,0,0,0,0
3290,강아지대학로,가게도 넓고 쾌적하고 좌석도 매우 편안합니다 혜화역에서 고개만 돌리면 보이는 최고의 접근성을 보입니다 와플 한입먹고 눈물을 흘 렸습니다 맛있습니다 한시간넘게 걸려서 온 노력이 아깝지 않습니다 분위기 맛 뭐 하나 빠지지 않는 최고의 카페 꼭 오십시오,0,0,1,0,0,0,0,0,0,0,0
3291,강아지대학로,커피도 맛있고 인테리어도 좋아요,0,1,1,0,0,0,0,0,0,0,0
3292,강아지대학로,직원분들이 친절해서 기분 좋았고요 역에서 가까워서 찾아가기도 좋았어요 유자에이드랑 바닐라라떼 진짜 맛있고 디저트는 말해뭐해 존맛최고였어용,1,1,0,1,0,1,0,0,0,0,0
3293,강아지대학로,너무너무어무 친절하셔요 커피도 마싯고 와플도 마싯고 아이스크림도 마싯어요 혜화 그렇게 자주왔는데 요긴 처음와봤 는데 그동안 왜 안왔나 모르겠어요,1,1,0,1,0,0,0,0,0,0,0
3294,강아지대학로,창가자리 넘 좋아요 봄가을로가기 딱 좋음,0,0,1,0,0,0,0,0,0,0,0
3295,가비아노,가볍게 쉬어가기 좋았습니다,0,0,0,0,0,0,0,0,0,0,0
3296,가비아노,커피는 제 취향이 아니었지만 케이크는 정말 맛있었어요,0,0,0,1,0,0,0,0,0,0,0
3297,가비아노,며칠 전 조각케익 먹자마자 바로 홀케익으로 주문했습니다 친절한 사장님의 한땀한땀 정성이 들어간 프렌치 느낌과 함께 이 애플카라멜티라미수 너무너무 맛있었습니다 진짜 강추강추,1,0,0,1,0,0,0,0,0,0,0
3298,가비아노,사장님도 엄청 친절하시구 디저트도 맛있어요,1,0,0,1,0,0,0,0,0,0,0
3299,가비아노,밤늦게갔는데 친절하시고 맛도있어서 좋았당 주변분위기도 좋은데 낮에오면 옥상한번 가보고싶다,1,0,0,1,0,0,0,0,0,0,0
3300,우르르,초코는 꼬끄가 쫀득하고 바닐라는 가벼운 느낌에 부스러지네요 필링도 두툼하고 가성비가 좋아요,0,0,0,0,0,0,0,0,0,1,0
3301,우르르,레터링케이크 이쁘게 만들어주셔서 친구가 좋아했어요 마카롱도 맛있더라구요,0,0,0,1,0,0,0,0,0,0,0
3302,우르르,하루 전에 연락드렸는데도 친절하게 답해주시고 말씀드린 그래도 만들어주셨어요 제가 당일 일이 있어서 조금 늦었는데도 기다려 주셨어요 이렇게 예쁘고 맛있는 케이크는 처음입니다 레드벨벳 케이크 처음 먹어봤는데 앞으로 레드벨벳 케이크만 먹을 것 같아 요,1,0,0,0,0,0,0,0,0,0,0
3303,우르르,몇 번째 재주문인지 모르겠어요 최애 마카롱,0,0,0,0,0,0,0,0,0,0,0
3304,우르르,사장님이 일이 많아서인지 힘들어보임,0,0,0,0,0,0,0,0,0,0,0
3305,우르르,자주는 못가도 주말마다 소량씩 사서 먹는곳인데 정말 맛있어서 후기 남겨요 천원에 마카롱 큼지막하고 무엇보다 먹을때마다 쫀득 한 식감에 너무 맛있는 필링의 조화가 굿이에요 그리고 여기 사장님은 꾸준히 오픈해주셔서 너무 좋아요 가끔씩 특별한날 준비하시 는 마카롱 특히 생딸기우유 마카롱 최고에요,0,0,0,1,0,0,0,0,0,0,0
3306,우르르,오늘 포장해서 집에 가져갔는데 엄마아빠가 마음에 들어하셨어요 엄마가 적당하고 맛있게 달아서 좋아하셨어요 무화과랑 말차맛 쫀맛 제가 단거 잘못먹는데도 맛있어서 옆에 앉아서 순삭했어유,0,0,0,1,0,0,0,0,0,0,0
3307,우르르,가성비 좋은 마카롱이에요 두번째 방문인데 맛있어요,0,0,0,1,0,0,0,0,0,1,0
3308,우르르,크리스마스 케이크 귀여워용,0,0,0,0,0,0,0,0,0,0,0
3309,바이미디저트,카페 분위기랑 가격 좋아요 맛은 쏘쏘였어용,0,0,1,0,0,0,0,0,0,0,0
3310,바이미디저트,타르트가 저렴한건 아니지만 맛있어요 포장도 예뻐요,0,0,0,1,0,0,0,0,0,0,0
3311,바이미디저트,음료가 너무 심심해요 디저트 맛은 쏘쏘,0,0,0,0,0,0,0,0,0,0,0
3312,바이미디저트,달달한 타르트 먹고 싶어서 방문했어요 먹을 만 합니다,0,0,0,0,0,0,0,0,0,0,0
3313,스타벅스 동숭길입구점,랭스터디는 어느 지점을 가든 좋습니당,0,0,0,0,0,0,0,0,0,0,0
3314,스타벅스 동숭길입구점,엄청 조용하지도 않고 그렇다고 공부를 못할정도로 시끄럽지도 않습니다 매장에 잔잔한 클래식 음악을 틀어주셔서 분위기가 공부하기 좋아요,0,0,0,0,0,0,0,0,0,0,1
3315,스타벅스 동숭길입구점,다 만족스럽고 좋은데 음악소리 큰 게 아쉽습니다 줄여달라고 부탁드려봐도 안된다고하시구요 특별히 조용한 음악을 틀지 않는 이상 귀마개를 껴도 뚫고들어옵니다,0,0,0,0,0,0,0,0,0,0,0
3316,스타벅스 동숭길입구점,밖에 테라스가 있어서 잠시 나가서 쉬기 좋습니다,0,0,0,0,0,0,0,0,0,0,0
3317,스타벅스 동숭길입구점,좌석 편하고 좋아요,0,0,0,0,0,0,0,0,0,0,0
3318,스타벅스 동숭길입구점,좋아요 집중 잘 되는 분위기입니다,0,0,0,0,0,0,0,0,0,0,1
3319,스타벅스 신당역점,타이푸옆 디저트별로 커피는 괜찮은편,0,0,0,0,0,0,0,0,0,0,0
3320,스타벅스 신당역점,고기 먹고 찾아낸 신당동 어긔 커피집 잘마셨습니다,0,0,0,0,0,0,0,0,0,0,0
3321,스타벅스 신당역점,인테리어 깔끔하고 커피도 맛있었어요,0,1,1,0,0,0,0,0,0,0,0
3322,스타벅스 신당역점,커피도 맛있고 공간도 좋아요,0,1,1,0,0,0,0,0,0,0,0
3323,스타벅스 신당역점,청구역 최고의 카페,0,0,0,0,0,0,0,0,0,0,0
3324,스타벅스 동묘앞역점,분위기는 어수선하고 시끄럽지만 직원분들 친절하시구 음식도 맛있어요,1,0,0,1,0,0,0,0,0,0,0
3325,스타벅스 동묘앞역점,책종류가 많아요 그리고 좌석도 다양하고 방 개수 많아서 좋았어요 아늑하게 시간 잘 보내다 왔습니당 재방문의사 에용 굳굳굳굳,0,0,1,0,0,0,0,0,0,0,0
3326,스타벅스 동묘앞역점,만화 읽기 쾌적하고 좋습니다 매트도 편해서 잠도 솔솔와요 낮잠자다 만화읽다 좋네요,0,0,0,0,0,0,0,0,0,0,0
3327,스타벅스 동묘앞역점,시간 때우기 좋아요 근데 사람 많고 좀 시끄러워요,0,0,0,0,0,0,0,0,0,0,0
3328,스타벅스 동묘앞역점,제가 숲 숲 다다녀봤지만 이런곳 처음이라 당황했네요 시마감인데 시쯤 음식과음료가 마감됐다고 혼자일할땐 일찍마감한다네요 일찍마감한다고 미리고지를해주셨다면 이용안했을텐데 저희팀바께없었는데 뒤에서계속 나가라는듯이정리를 틱틱하시고 너무불쾌했네요 다음엔 다시는 이용못할것같아요,0,0,0,0,0,0,0,0,0,0,0
3329,스타벅스 동묘앞역점,관리 잘되어있고 깔끔해요,0,0,0,0,1,0,0,0,0,0,0
3330,스타벅스 동묘앞역점,만화책 종류 많고 자리도 편해요,0,0,0,0,0,0,0,0,0,0,0
3331,벌툰 대학로점,안마받으면서 푹 쉬고나와서 음료 한 잔까지 마시니 넘 좋고 힐링했어요 그리고 응대해주시는 데스크 직원분이 친절하셔서 더 좋았어요,1,0,0,0,0,0,0,0,0,0,0
3332,벌툰 대학로점,너무 피곤해서 급히 예약하고 갔는데 푹 쉴 수 있었어요 안마의자도 튼튼했고 모드가 여러가지라 좋았고 끝난 후에 음료 서비스까지 창가 자리에 앉아서 대학로 풍경 둘러보는 게 의외로 기억에 많이 남았네요,0,0,0,0,0,0,0,0,1,0,0
3333,벌툰 대학로점,지방에서 볼일볼겸 와서 연극기다리는데 잠깐 쉬기 너무 좋았어요 미리예약하고 가니 가격도 저렴하구 만원의행복이네요,0,0,0,0,0,0,0,0,0,1,0
3334,벌툰 대학로점,친절하신직원분과 시원한안마의자 끝나고나서의 시원한음료까지 더운여름날돌아다니다 쉬기딱좋아요,1,0,0,0,0,0,0,0,0,0,0
3335,벌툰 대학로점,쾌적하게 잘 쉬다 나왔습니다 대학로에 편하게 쉴 수 있는 공간이 많지 않아서 소중합니다 오래오래 장사해주세요,0,0,0,0,0,0,0,0,0,0,0
3336,벌툰 대학로점,정말 친절하고 무엇보다 매장부터 화장실까지 청결하고 깨끗해요 그리고 음료도 맛있어요 쿠키도 잘 먹었어요,1,0,0,1,1,1,0,0,0,0,0
3337,벌툰 대학로점,조용한 분위기에 안마의자도 받고 커피 마시면서 간단한 게임까지 좋았습니다,0,0,0,0,0,0,0,0,0,0,1
3338,벌툰 대학로점,한시간 잘 쉬고 나왔습니다 사진은 깜빡하고 못찍었어요 또 방문 할게요,0,0,0,0,0,0,0,0,0,0,0
3339,이디야커피 동대문점,평일 오후라 그런지 사람이 많이 없어서 조용하고 좋았어요 안쪽 테이블에 앉았더니 살짝 습한 느낌이 들긴 했지만 인테리어가 깔끔해서 사진이 잘 나오더라구요 밀크티는 엄청 특별한 맛은 아니었습니다 그래도 대학로 들르면 한번쯤 가기 좋은 카페인 것 같아요,0,0,1,0,0,0,0,0,0,0,0
3340,이디야커피 동대문점,진짜 밀크 맛집 조명에 효과로 셀피맛집,0,0,0,0,0,1,0,0,0,0,0
3341,이디야커피 동대문점,밀크티 덕후들인데 조금 덜 달았으면 더 맛있을거같아요,0,0,0,0,0,0,0,0,0,0,0
3342,이디야커피 동대문점,빵이 진짜 맛있음 커피도 완전 내 스타일 직원분들이 친절하셔서 대학로 오면 까페는 여기만 와요 그리고 올 때마다 매장이 청결하고 화장실도 깔끔해서 좋음,1,1,0,1,1,0,0,0,0,0,0
3343,이디야커피 동대문점,밀크티 넘 맛있어요,0,0,0,0,0,1,0,0,0,0,0
3344,이디야커피 동대문점,오후홍콩커피랑 밀크티 핵맛있어요 빵 먹으러 온건데 음료 완전 맛있어서 감동 커피 마시면서 빵 기다리는데 갓구어진 빵 눈물 흘리며 먹음 너무 맛있어요 배불러서 빵 포장해왔어요 직원분도 진짜 친절하시고 또 올거에요 굿굿굿,0,0,0,1,0,1,0,0,0,0,0
3345,이디야커피 동대문점,밀크티도 커피도 맛있습니다 버터가 들어간 빵은 으뜸입니다,0,0,0,1,0,1,0,0,0,0,0
3346,이디야커피 동대문점,커피가 맛있음니다 뽀로야우도 따뜻할때 먹으면 괜찮을것같네요,0,0,0,1,0,1,0,0,0,0,0
3347,이디야커피 동대문점,라떼랑 패인애플 번 맛있게 먹고 왔어요 밀크티도 포장해 왔어요,0,1,0,1,0,1,0,0,0,0,0
3348,오후홍콩 대학로점,피자도 맛있고 식탁이넓어 공부맛집입니다,0,0,0,1,0,0,0,0,0,0,1
3349,오후홍콩 대학로점,넓어요 책 보거나 작업 하기에도 괜찮은 것 같습니다 단 어르신 그룹이 많이 오셔서 좀 왁자지껄 할 때도 있습니다,0,0,1,0,0,0,0,0,0,0,1
