,cafe,review,친절해요,커피가 맛있어요,인테리어가 멋져요,디저트가 맛있어요,매장이 청결해요,음료가 맛있어요,대화하기 좋아요,사진이 잘 나와요,뷰가 좋아요,가성비가 좋아요,집중하기 좋아요
1049,카페씨,융드립 커피 마시고 더치커피 구입 작은 패트병에 덜어주셨고 더치 약간 시음했는데 진하고 신선하고 살짝 새콤 일주일만에 열었는데 살 때보다 원액 신 맛이 훨씬 강해졌어요 우유에 희석시키니 괜찮습니다,0,1,0,0,0,0,0,0,0,0,0
1050,이태리탁,롯백에 소개됐던 쿠키샵이 직장 근처에 와 그냥 지나칠 수 없어 시그니처 튀튀쿠키와 남편이 좋아하는 인절미를 구입했는데 앗 저 귀여운 뽀또 프레즐 오리 노노 펠리칸 머랭을 서비스로 주셨다 감사합니다 맛있게 잘 먹겠습니다,0,0,0,1,0,0,0,0,0,0,0
1051,이태리탁,밥먹으러 가기 전에 잠깐 들려서 상자 포장했다가 하나 맛보고 앉은 자리에서 한상자를 비워버렸습니다 맛보지 못한 쿠키들이 있어 너무 아쉽네요 고를 때 고민되시는분들 마약옥수수 강력추천합니다,0,0,0,1,0,0,0,0,0,0,0
1052,이태리탁,배민으로 먹을 때도 맛있었는데 매장에서 먹으니 더 맛있네요 잘 먹었습니다,0,0,0,0,0,0,0,0,0,0,0
1053,이태리탁,추워서 황급히 들어갔는데 쿠키 너무 맛있었어요 직원 분들도 너무 친절하십니다 다만 자리가 협소해서 매장 이용하려면 자리부터 잡으셔야 해요 설날 호랑이 머랭 쿠키도 너무 귀여워요 여기저기 일러스트 아기자기하고 인테리어도 깔끔하고 커피도 맛있었습니다 다음에 선물할 일 있으면 여기 쿠키 선물할 거 같아요,0,1,1,1,0,0,0,0,0,0,0
1054,이태리탁,가게 이름도 예쁘고 포장지도 예뻐요 쿠키도 예쁜데 맛도 좋아요 좀 비싸긴 하지만 쿠키하나로 하루 종일 먹어도 될 거 같네요,0,0,0,1,0,0,0,0,0,0,0
1055,이태리탁,너무 맛있고 귀요워요,0,0,0,0,0,0,0,0,0,0,0
1056,이태리탁,튀튀쿠키 맛있었어요 다른 쿠키들도 넘 궁금하고 나올 때 하트카라멜도 챙겨주시구 담에 또 가려구요,0,0,0,1,0,0,0,0,0,0,0
1057,이태리탁,롯데본점 팝업매장에서 구입 개인적으로 마약옥수수랑 말차맛 맛있었어요 매장이 멀지 않아서 담번엔 매장으로 가봐야겠어요,0,0,0,1,0,0,0,0,0,0,0
1058,이태리탁,진짜 존맛탱 쿠키집입니다 서촌에 왔다면 꼭 들려야하는 쿠키집,0,0,0,1,0,0,0,0,0,0,0
1059,오가다 인사동점,옆에 세워진 모형과 같은 모양이예요 익숙한 것이 모여 새롭진 않지만 맛있어요 붕어빵 입이 생각보다 깊어서 아이스크림 양이 많고 천천히 먹으면 아이스크림이 녹아서 빵을 먹을 때 옆으로 흘러 넘칩니다 조심해서 드세요,0,0,0,0,0,0,0,0,0,0,0
1060,오가다 인사동점,딸기크림치즈 와플 맛났어요 다음엔 붕어 아이스크림 도전 해봐야죠,0,0,0,0,0,0,0,0,0,0,0
1061,오가다 인사동점,따뜻하고 바삭한 와플속에 달콤한 바닐라크림과 사과쨈 맛있었고요 시그니처 아이스크림 붕어빵 너무신기하고 맛있었어요,0,0,0,1,0,0,0,0,0,0,0
1062,오가다 인사동점,쫀득쫀득 생각보다 맛있어요 아이스크림도 진해요,0,0,0,1,0,0,0,0,0,0,0
1063,오가다 인사동점,추억의 와플 맛있어요,0,0,0,1,0,0,0,0,0,0,0
1064,아붕,주말에는 주차하기 번거로울 수 있어요 인 음료 주문 해야하고 가격대가 있어요 산 아래 바람이 불어서 지금 딱 앉아있기 좋아요,0,0,1,0,0,0,0,0,0,0,0
1065,아붕,주말에 방문해서 그런가 주차공간은 많지 않아서 주택가에 주차했어요 음료 가격이 으마으마 하네요 대신 뷰도 좋고 시원해서 힐링 하고 갑니다,0,0,0,0,0,0,0,0,1,0,0
1066,아붕,자연속에서 커피마시는 것 같아 좋았어요,0,0,1,0,0,0,0,0,0,0,0
1067,아붕,굿 따뜻한 음료 필수에요,0,0,0,0,0,0,0,0,0,0,0
1068,아붕,커피맛 보다는 뷰 보러 겁니다,0,0,0,0,0,0,0,0,1,0,0
1069,아붕,뷰가 다한 카페 하지만 왜인지 모르게 종업원들은 식당 조리용 투명 마스크를 쓰고 있다,0,0,0,0,0,0,0,0,1,0,0
1070,더 피아노,아이스아메리카노 원 비싼가격인데도 불구하고 디저트 일회용접시 일회용포크에 나오는거보고 기겁 뷰도 좋고 조용하고 한 적해서 대화하기도 좋은데 시스템 넘불편 주차요원 두명계시는데 발렛안되서 매번 차 빼러 나가야하고 키오스크주문하면 음료나올 때 문자알림준다고 번호 등록하래놓고 알림은 커녕 마이크로 번호부를때마다 확인해야함 음료도 엄청늦게나옴 이 좋은 뷰,0,0,0,0,0,0,1,0,1,0,1
1071,더 피아노,하늘보며 앉아서 힐링하기 좋습니다 커피도 진하고 맛있어요,0,1,0,0,0,0,0,0,1,0,0
1072,더 피아노,조용히 힐링하기 좋은 카페 커피값은 사악하지만 맛있고요 음료종류는 다양하지않아 아쉽 베이커리 종류가 없어 살짝 아쉽지만 커피 에 집중하기 조아요,0,0,0,0,0,0,0,0,0,0,1
1073,더 피아노,커피도 맛있고 뷰가 진짜 장난 없네요 서울에 이런 뷰좋은 카페가 있다는 게 놀라울 정도,0,1,0,0,0,0,0,0,1,0,0
1074,더 피아노,뷰가 너무 좋네요 멀리서 온 보람이 있어요 다음에도 종로 오면 꼭 방문해야겠어용,0,0,0,0,0,0,0,0,1,0,0
1075,더 피아노,그냥 그래요 야외의 반은 이용 못하게 막아놨고 가격은 높은데 키오스크에 설프서비스로 직원 한 명 놓고 장사하는 곳이네요,0,0,0,0,0,0,0,0,0,0,0
1076,더 피아노,전망굿 조용하고 오픈되어있어서 좋네여 근데 커피맛에비해 비싸네여,0,0,0,0,0,0,0,0,1,0,0
1077,더 피아노,경치는 좋으나 서비스는 그닥,0,0,0,0,0,0,0,0,1,0,0
1078,앤팩토리,날씨가 좋은 날이라 오랜만에 방문했습니다 전망 좋습니다,0,0,0,0,0,0,0,0,1,0,0
1079,앤팩토리,우연히 친구와 평창동에 갔다가 발견한 갤러리 까페 들어가는 입구부터 예술작품들이 인상깊은 장소였습니다 꼭 다시 가보고 싶어요,0,0,1,0,0,0,0,0,0,0,0
1080,앤팩토리,갤리리도 볼수잇고 전망이 좋네어,0,0,0,0,0,0,0,0,1,0,0
1081,앤팩토리,전망 이 근처 카페들의 장점이죠 규모가 크지는 않지만 작품전시 하고 있습니다,0,0,0,0,0,0,0,0,1,0,0
1082,앤팩토리,작품도 보고 이야기하기 좋아요,0,0,1,0,0,0,0,0,0,0,0
1083,앤팩토리,전망 좋은 평창동 카페,0,0,0,0,0,0,0,0,1,0,0
1084,앤팩토리,예술적인 카페예요 좋아요,0,0,1,0,0,0,0,0,0,0,0
1085,앤팩토리,전망이 넘 좋아요 치즈케잌맛집입니가,0,0,0,1,0,0,0,0,1,0,0
1086,앤팩토리,뷰 좋구요 브런치도 먹을만해요,0,0,0,1,0,0,0,0,1,0,0
1087,키미아트,갈수록 발전하는 카페비비 비비이사님 뵙고싶다,0,0,0,0,0,0,0,0,0,0,0
1088,키미아트,밑에층은 노트북 사용하는 분들이 너무 많아서 살짝 당황했는데 루프탑으로 올라가니 분위기 너무 좋음 전용 주차도 있고 앞으로 자주 갈듯,0,0,1,0,0,0,0,0,0,0,0
1089,키미아트,카페 분위기 좋고 친절해요 또 오고싶은 카페네요 주차하기도 좋아요,1,0,1,0,0,0,0,0,0,0,0
1090,키미아트,또시켜먹었어효 쫌만더머무르게요,0,0,0,0,0,0,0,0,0,0,0
1091,키미아트,구기동에 분위기도 좋고 규모도 큰 카페가 생겨서 너무 좋아요,0,0,1,0,0,0,0,0,0,0,0
1092,키미아트,카페비비 너무맛있어요 커피 맛집 베이커리류 맛집 뷰 맛집 최고최고,0,1,0,1,0,0,0,0,1,0,0
1093,키미아트,비비이사님 넘 조아요 허 빨리 코로나 풀리고 다시 영업시간 새벽 시까지 열었으면 좋겠어요 고요한 새벽과 정말 찰떡인 카페이네용,0,0,0,0,0,0,0,0,0,0,0
1094,키미아트,커피도 맛있고 파운드케익도맛있고 인테리어도 좋고 뷰도 좋고 가끔 멍뭉이 비비이사님도 있고,0,1,1,1,0,0,0,0,1,0,0
1095,키미아트,비비 이사님의 맛난 카페 늦게까지 하는 아름답고 맛있는 곳,0,0,0,0,0,0,0,0,0,0,0
1096,스타벅스 종로평창동점,커피도 맛있고 깔끔해서 좋은데 주문받는 분이 너어무 불친절하고 무표정에 대충의 말투 일반 직원에 비해 연령 높음 영수증도 안 주셔서 달라고 해서 받았습니다 아쉽지만 다시 안 오고 싶네요,0,1,0,0,0,0,0,0,0,0,0
1097,스타벅스 종로평창동점,주차는조금힘들긴한데 인테리어랑 커피맛도좋구 굿,0,1,0,0,0,0,0,0,0,0,0
1098,스타벅스 종로평창동점,자주 방문합니다 늘 친절하시고 음료랑 디저트 뿐 아니라 식사메뉴도 다 맛있어요 조용하게 차 마시고 책 읽기 좋은 분위기에요 층 갤러리도 볼 수 있어서 좋아요,1,0,1,0,0,1,0,0,0,0,0
1099,스타벅스 종로평창동점,밥먹고 주차되는 카페 찾다 헤마다 다시 돌아온 이곳 일단은 쉬고싶다는 마음으로 갔는데 정말 편안한 자리에서 푹쉬었다는,0,0,1,0,0,0,0,0,0,0,0
1100,스타벅스 종로평창동점,조용하고 분위기도 좋아서 남편과 여러번 방문하였는데 종업원인지 사장님이지 모르겠으나 표정이 너무 딱딱하고 말투도 불친절해서 쉬러간 기분이 별로 좋질않네요 갈때마다 좀 아쉽네요,0,0,1,0,0,0,0,0,0,0,1
1101,스타벅스 종로평창동점,분위기있는 카페입니다 시끌벅적하지않고 조용하고 넘 좋아여 커피가 맛있어여,0,1,1,0,0,0,0,0,0,0,1
1102,스타벅스 종로평창동점,맛난 케익과 커피 편안한 분위기와 멋진 갤러리 넘 맘에 드네요,0,0,1,1,0,0,0,0,0,0,0
1103,스타벅스 종로평창동점,이 카페 좋아했는데 일하시는 분들이 마스크 벗고 계속 통화하시고 왔다갔다 하고 음료 만들고 해서 다신 안가려구요 한 세분이 마스크 벗고 계시니까 너무 당황스럽네요 이런 카페는 처음 봤어요 일하시는 분들 돌아다니면서 말하실거면 좀 마스크 쓰고 다니셔야죠,0,0,0,0,0,0,0,0,0,0,0
1104,수애뇨339,새로생긴 동네맛집 산골마을에 요런 카페 생겨 넘나 좋아요 남친은 우유알러지가 있는데 오트밀로 바닐라라떼 최애메뉴 바닐라 진 짜빈으로 만들어 향과 맛의 차원이 다르다 하면서 저는 오후엔 페퍼민트티를 마시는데 가슴까지 션해지는 꺼 더라구요 어 쩐지 디져트도 올때마다 다른걸 먹어봤는데 당일판매라 그런지 신선하고 촉촉 좋아요 하나 이색적인건 뷰가 락궁뷰,0,1,0,1,0,1,0,0,0,0,0
1105,수애뇨339,슈크림을 좋아해서 자주 먹어요 다쿠아즈도 맛어요 천연 바닐라 빈 들어가있어서 향긋하고 생크림도 고급져요,0,0,0,1,0,1,0,0,0,0,0
1106,수애뇨339,새로나온 꽃 얼그레이 케잌 조금 작은듯한데 홍차향이 진하고 많이 안달고 맛나요 남편 생일케잌으로 주문 해야겠어요 아 그리구 바질토마토에이드 건강한 어른용 여름음료 첨 먹어보는 맛,0,0,0,1,0,1,0,0,0,0,0
1107,수애뇨339,디저트 크기도 모양도 귀여워서 포장해왔습니다 아쉬운 건 분 만에 라떼에 거품이 다 가라앉아서 우유거품맛을 하나도 느낄 수 없었다는 거였어요 음료는 라떼말고 다른 걸로 먹어야겠네요,0,0,0,0,0,0,0,0,0,0,0
1108,수애뇨339,호주에서 롱블랙 자주 마시는데 맛이 똑같아서 너무 놀랐어요 케이크도 맛있고 너무 좋습니다,0,0,0,1,0,0,0,0,0,0,0
1109,수애뇨339,매우 예쁘고 감성 가득가득한 느낌이에요 휘낭시에는 겉바 속촉으로 맛이 매우 좋았어요 바스크의 경우 단단하기보단 크리미한 느낌이였고 제 기준에는 달았지만 맛은 좋았습니다,0,0,1,1,0,0,0,0,0,0,0
1110,수애뇨339,동네에 예쁜 카페가 새로 생겼네요 아메리카노는 두 종류가 있어요 디저트는 안먹어봤지만 귀엽고 맛있을 것 같아요,0,0,1,0,0,0,0,0,0,0,0
1111,수애뇨339,처음 방문했는데 커피가 생각보다 맛있어요 디저트는 고민하다 피낭시에 주문했는데 그냥 제 기준엔 오버쿠킹 된거같아요 냄새도 좋고 맛도 괜찮았는데 겉이 너무 바삭 촉촉하고 쫀득한 스타일은 아니예요 다음번엔 다쿠와즈나 다른거 먹어보려구요,0,1,0,1,0,0,0,0,0,0,0
1112,스윗픽,사장님 너무너무 친절하세요 내부 분위기가 너무 좋아요 뷰가 너무 좋아요 다음에는 노을 질때 맞춰서 오려구요 아 지트로 자주 올게요,1,0,1,0,0,0,0,0,1,0,0
1113,스윗픽,채광 넘치고 경치좋고 분위기 멋진 카페에요 커피와 티라미수도 맛있어요 테이블 와다다 붙여 번잡시럽게 운영하실법도 한데 널찍하고 한적하게 만들어놓아서 힐링공간같은 분위기가 잘 유지돼요 입구의 작품도 멋져요,0,1,1,1,0,0,0,0,0,0,0
1114,스윗픽,한적한 느낌이 너무 좋아요 티라미슈 위에 파우더가루없어서 좋았습니다,0,0,0,1,0,0,0,0,0,0,0
1115,스윗픽,모뜨 문 닫아서 여기로 왓어요 통창에서 바라보는 뷰가 참 좋아요 독특한 작품도 인상적 케이크를 못 먹어봐서 아쉽네요,0,0,0,0,0,0,0,0,1,0,0
1116,스윗픽,한산하고 너무 좋았어요 아메리카노도 맛있고 당근케익도 맛있었어요 여유있게 있을 수 있어서 비싸단 생각 안 들었네요,0,1,0,1,0,0,0,0,0,0,0
1117,스윗픽,뷰 보러 오는곳 좌석이 몇개 없고 서로 널찍이 떨어져있어 공간이 여유로워요,0,0,0,0,0,0,0,0,1,0,0
1118,스윗픽,매장이 넓고 테이블은 많지 않아서 쾌적했어요 커피도 맛있었고 평창동 뷰가 탁 트여서 기분 좋은 시간이었네요 소품들이 아기자기하고 예쁘고 걸린 그림들 분위기도 좋았구요 사장님이 친절하세요,1,1,1,0,0,0,0,0,1,0,0
1119,카페센,헉 진짜 맛있네요 사르르르르 녹는 맛 단짠의 맛 딸기 시럽 인지 쥬스인지 많이 안 달고 입에 착착 붙어요 완두콩빙수 진짜 맛있어요 완두콩갈은거 소금이랑 환상적인 맛 옥수수빙수가 시즌한정 매뉴라던데 꼭 가서 먹어보려구요 너무 기대되네요,0,0,0,1,0,0,0,0,0,0,0
1120,카페센,달지 않으면서 너무너무 시원하구 각각의 맛을 느낄 수 있는 빙수였어요 그리구 카라멜 솔트 빙수 는 위에 아몬드 슬라이스가 많이 올려져 있는데 빙수와 함께 떠서 주신 소금을 뿌려먹으면 너무너무 색다른 맛을 느낄 수 있어요 설명에는 단짠단짠 맛이라구 씌여 있는데 막 짜지두 않구 적당히 달아서 먹기가 편했어요 부암동에 갈 때마다 들를 예정이에요,0,0,0,1,0,0,0,0,0,0,0
1121,카페센,계절마다 다양한 과일빙수는 샤베트보다 부드럽고 정성이 듬뿍 들어있는 최고의 빙수예요 인절미 빙수는 언제 먹어도 너무 맛있어요,0,0,0,1,0,0,0,0,0,0,0
1122,카페센,부암동 빙수집 부빙 딸기빙수가 먹고싶어서 찾아서 갔는데 공휴일이라 그런지 주차공간도 없고 대기시간은 시간 충격적 주변 에 주차할 공간이 없고 불법주차하기 싫어서 민영주차장 시간 원 이용 빙수나오는데 엄청 오래걸려요 분정도 걸렸고 먹는 데는 분컷이었습니다 새콤달콤한 딸기랑 우유얼음이랑 먹으니깐 시원하니 좋았어요 하지만 너무 웨이팅이 길어요,0,0,0,1,0,0,0,0,0,0,0
1123,카페센,팥 안 좋아하는데 팥도 맛있고 여름이 기대되어요,0,0,0,1,0,0,0,0,0,0,0
1124,카페센,인생 빙수 집만 가까우면 매일 먹고 싶네요,0,0,0,1,0,0,0,0,0,0,0
1125,카페센,부암동 빙수 부빙 딸기빙수랑 계절한정 단팥죽 먹었는데 단팥죽은 달지 않고 맛있고 찐단팥맛 쫄깃한 새알도 맛있어요 딸기빙수도 너무 맛있어요 다음에 다른 빙수도 도전해 보구 싶어요,0,0,0,1,0,0,0,0,0,0,0
1126,부빙,분위기로 먹는 카페 십수년째 다니는데 지하는 첨가봤네요 아이들과 온다면 지하층 좋아요,0,0,1,0,0,0,0,0,0,0,0
1127,부빙,올라가기 쬐끔 힘든 곳이지만 풍경은 아주 좋은 곳이다 근데 음료수는 정말 비싸고 너무 맛이 없다 커피랑 음료수까지 맛있었다면 대박일텐데 커피프린스에 나온 곳이라는 것이 아이러니,0,0,0,0,0,0,0,0,1,0,0
1128,부빙,뷰맛집 날씨 좋은 날 부암동에 간다면 방문해볼 만해요 드라마 커피프린스 관련 소품들은 거의 없어졌어요,0,0,0,0,0,0,0,0,1,0,0
1129,부빙,와 뷰를보면 맥주가 천원인 이유 이해가능쓰,0,0,0,0,0,0,0,0,0,0,0
1130,부빙,예전부터 와보고 싶었던 곳이었는데 음료 가격은 다소 높지만 조용하고 한적한 위치에 있어 좋아요,0,0,0,0,0,0,0,0,0,0,1
1131,부빙,뷰가 참좋네요 문앞에 앉아계신 아버님도 친절하시구요,1,0,0,0,0,0,0,0,1,0,0
1132,부빙,음료값이 비싸고 주차는 힘들었지만 풍경 하나로 다 용서할만한 곳,0,0,0,0,0,0,0,0,1,0,0
1133,부빙,뷰가 다했음 뷰 빼고는 음료는 그냥저냥 인테리어도 그냥저냥 음료가 천원 만원,0,0,0,0,0,0,0,0,1,0,0
1134,부빙,뷰맛집만 인걸로 할래요 직원들도 친절하지 않고 커피맛도 별로고 종이컵에서는 이상한 냄새까지 음료값은 비싸고 비추입니다,0,0,0,0,0,0,0,0,1,0,0
1135,산모퉁이,오래 앉아 있을 만큼 자리가 편하진 않은데 커피는 다소 비싼 느낌 디저트도 비싸지만 맛있음 냉동이 아니라 생블루베리여서 만족 열리는 창이 없어 환기가 잘안되는 느낌이었음,0,0,0,1,0,0,0,0,0,0,0
1136,산모퉁이,밤부에서 하는 덴줄 알았으면 안갔을텐뎈 빵은 제 스타일은 아니고 커피는 마실만 합니다 요즘 같으면 테라스 자리가 좋겠지만 주말엔 그늘진 테라스 앉기가 쉽지않네요 치아바타 샌드위치가 원 정돈데 특별할건 없어서 재방문의사는 없습니다,0,0,0,0,0,0,0,0,0,0,0
1137,산모퉁이,만남 가지기 좋아요,0,0,0,0,0,0,0,0,0,0,0
1138,산모퉁이,카페구조가 좀독특하고 야외정원이 예쁘네요 다만 야외에 앉아있음 날파리 벌레가 많아요 커피맛은 괜찮은데 빵값이 좀비싸고 주 차 시간까지 천원내야해요,0,1,1,0,0,0,0,0,0,0,0
1139,산모퉁이,분위기 엄청 좋고 빵도 맛있어요,0,0,1,1,0,0,0,0,0,0,0
1140,산모퉁이,꾸물꾸물한 날씨에 살짝 찬기운도 느껴지고해서 따뜻한 커피 한 잔 하러 들렀는데 커피맛도 좋고 빵도 맛있고 사진도 너무 예쁘게 잘나오네요 다음에 꼭 다시 찾아와야겠네요,0,1,0,1,0,0,0,1,0,0,0
1141,산모퉁이,저녁에 가니 빵이 거의 없어요 분위기 좋고 커피는 조금 써요,0,0,1,0,0,0,0,0,0,0,0
1142,산모퉁이,날이 갑자기 춥고 흐려졌지만 밖이 좋았어요 테라스에 있고 싶었는데 층 테라스는 잠겨있어서 아쉬웠어요 단거 잘 못먹는 모녀에겐 뺑오쇼콜라는 맛있었고 블루베리 크로와상은 좀 과했어요 하지만 어머니 픽이라 아메리카노랑 먹었어야 하는건데 아쉬워서 또 가려구요 그리고 화장실이 인테리어가 튀어서 찍어봤어요,0,0,0,1,0,0,0,0,0,0,0
1143,블랑제메종북악,브라우니 먹고 싶어 일부러 들렸어요 목적지가 스코프예요 브라우니는 하루 이틀 냉장고에 두고 먹어도 좋지만 스콘은 바로 먹는 게 맛있어요 종이 봉투에 오래 두면 겉이 바삭한게 없어지더라구요 브라우니 중독성 있어 큰일이예요,0,0,0,1,0,0,0,0,0,0,0
1144,블랑제메종북악,스콘과 브라우니 맛집이예요 브라우니는 어떤걸 선택해도 맛있어요 너무 달다싶지만 단 맛에 먹는 거니까요 스콘도 바삭하고 고소 해요 버터향도 풍부해서 좋아요 커피는 신맛나는 원두네요 원두종류를 선택하면 좋을텐데 그점은 아쉬워요,0,0,0,1,0,0,0,0,0,0,0
1145,블랑제메종북악,부암동 지나다 스콘 맛집이라는 일행의 말에 모임 인원 맞춰서 얼그레이스콘 버터스콘 치즈스콘 하나씩 포장해서 왔어요 명성에 걸맞게 달지 않고 바삭하고 담백하니 맛나네요 스콘 맛집 인정 제 입맛엔 얼그레이스콘이 제일 맛있어요,0,0,0,1,0,0,0,0,0,0,0
1146,블랑제메종북악,포장한 메뉴는 얼그레이 스콘 브라우니 레몬케이크 바나나케이크 버터스콘 쇼트브래드비스킷 라꽁비에드버터 클로티트크림 언 제 또 여기 오겠어 하고 왕창 샀는데 욕심 너무 부리지 말걸 고등학교 때 부암동 사는 애들이 추천해줬던 곳 이렇게 사람이 많았었나 싶다 너무 사람 많아서 그냥 빵 먹고싶은거 포장하고 근처 조용한 카페가는걸 추천한다,0,0,0,0,0,0,0,0,0,0,0
1147,블랑제메종북악,미술관 왔다가 브런치겸 들렀던 부암동 무계원 정류장 바로앞 케잌도 맛있지만 스콘이 진짜 너무 맛있다 스콘엔 버터가 국룰인데 구 매해야하는 점이 불편했만 저렴한 가격이니 끄덕끄덕 커피는 플랫화이트를 주문 뷰도 멋진,0,0,0,1,0,0,0,0,1,0,0
1148,블랑제메종북악,스콘 사러 방문 맛은 믿먹 크고 촉촉 직원분 친절하십니다 일부터 일까지 부암동스코프는 영업 안하시니 참고하세요,1,0,0,0,0,0,0,0,0,0,0
1149,블랑제메종북악,다음 사진들은 볼만합니다 떡처럼 사진을 찍었지만 티라미수 입니다 맛있네용,0,0,0,1,0,0,0,0,0,0,0
1150,블랑제메종북악,두번째 방문이네요 맛있어요 브라우니 많이 달긴 한데 맛있어요,0,0,0,1,0,0,0,0,0,0,0
1151,블랑제메종북악,꼭 가봐야할 스콘 집 정말 맛있습니다,0,0,0,1,0,0,0,0,0,0,0
1152,부암동스코프,오늘은 갑자기 미숫가루가 생각나서 남준이처럼 미숫가루 먹었어요 여름엔 먹어줘야죠 달지 않아서 좋네요,0,0,0,0,0,1,0,0,0,0,0
1153,부암동스코프,오늘은 파배오가 먹고 싶어서 먹었어요 산책하며 비타민 보충하고 좋아요,0,1,0,0,0,0,0,0,0,0,0
1154,부암동스코프,날이 쌀쌀해서 오래간만에 녹차라떼 맛있어요,0,1,0,0,0,0,0,0,0,0,0
1155,부암동스코프,밀크티랑 아메리카노 맛있어요,0,1,0,0,0,0,0,0,0,0,0
1156,부암동스코프,파배오 마시며 뜨개질 파배오 맛있어요,0,1,0,0,0,0,0,0,0,0,0
1157,부암동스코프,바람이 돌풍처럼 불어서 투표하고 차 마시러 밀크티와 모카라떼 따스하니 좋네요 음악도 좋고,0,1,0,0,0,1,0,0,0,0,0
1158,부암동스코프,댕댕이들이랑 산책하다 스탐티쉬 들려서 밀크티 얼른 뿌리 나렴 편안해서 좋은 카페에요,0,1,0,0,0,0,0,0,0,0,0
1159,부암동스코프,홍시수정과 퐁당 겨울에 딱 맞는 음료네요 수정과도 맛있고 홍시가 통째로 들어 있어서 잘 마시고 숟가락으로 떠 먹었어요,0,0,0,0,0,1,0,0,0,0,0
1160,수연산방,나폴녜옹제과점 방문하려다 성북동빵공장 방문했는데 탁월한 선택이었어요 발렛비 원 발생하지만 출고때 차 갖다주셔서 편하고 좋고 층에서 주문하고 스탠드 테이블 테라스에서 취식할 수 있고 층에도 취식공간 있어요 팡도르 커스터드 그닥 선호하지 않 는데 이곳 팡도르 커스터드 이정도 맛이면 즐겨먹을듯 하고 쇼콜라도 커피도 산미는 적고 초코맛 진하고 고소한맛 아메리,0,0,0,0,0,0,0,0,0,0,0
1161,수연산방,건물이 독특하게 층인데 층이고 계단따라 지하로 내려가면 거기가 층인 구조에요 분위기도 좋고 빵종류가 매우 다양해서 빵 좋아하시는분들 오면 지갑이 거덜 나겠어요 저희도 오늘 와서 계곡에서 먹던 닭백숙한마리값 먹고 갑니다 참 커피를 핸드드립으로 내리네요 전 맛있게 마셨습니다 친구들과 수다떨기도 좋고 한번 놀러 오세요,0,1,0,1,0,0,1,0,0,0,0
1162,수연산방,성북동면옥집에서 냉면먹고 내려가면 커피 마시기 좋네요 다양한 빵들과 야외테이블이 있어요 배가 불러서 연탄빵은 집에서 초코렛 과 초코크림이 듬뿍들어서 맛있네요,0,1,0,1,0,0,0,0,0,0,0
1163,수연산방,이집도 워낙 유명한 집이죠 년전인가 한번 가보고 이번에 두번째로 갔는데 여전히 사람들이 많네요 빵값이 비싸기로도 유명해요 연 탄빵이 특이해 데려왔고 생크림 팡도르도 데려와 먹었는데 맛있어요 다만 연탄빵에도 모카크림이 듬뿍 팡도르에도 생크림과 슈거파 우더까지 듬뿍이라 칼로리 폭탄인 빵이었어요 이런빵은 아주아주 가끔 먹어줘야할 것 같아요,0,0,0,1,0,0,0,0,0,0,0
1164,수연산방,유기농 재료라 안심 늦게 가면 빵이 없어요,0,0,0,0,0,0,0,0,0,0,0
1165,수연산방,친구랑 테라스에 앉아서 빵이랑 커피 먹는데 날씨도 좋아서 그런지 기분이 넘 좋았어요 빈손으로 가기 아쉬워서 맛나보이는거 몇개 포장해왔는데 베리베리 라는 빵이 담백하면서 고소 달달하니 진짜 맛있었어요 조만간 카페인 충전하러 방문하겠습니당,0,1,0,1,0,0,0,0,0,0,0
1166,수연산방,빵과 커피맛나고 분위기 최고예요,0,1,1,1,0,0,0,0,0,0,0
1167,수연산방,빵 맛있고 주변 녹음이 싱그럽네요,0,0,0,1,0,0,0,0,0,0,0
